{
  "$schema": "https://json-schema.org/draft/2020-12/schema",
  "$id": "https://github.com/HomericIntelligence/Mnemosyne/schemas/skill-frontmatter.schema.json",
  "title": "Skill Frontmatter",
  "description": "Schema for YAML frontmatter in Mnemosyne skill files.",
  "type": "object",
  "required": ["name", "description", "category", "date", "version"],
  "additionalProperties": true,
  "properties": {
    "name": {
      "type": "string",
      "pattern": "^[a-z0-9][a-z0-9-]*[a-z0-9]$|^[a-z0-9]$",
      "description": "Kebab-case skill identifier."
    },
    "description": {
      "type": "string",
      "minLength": 1,
      "description": "A concise capability and specific trigger, using ASD-STE100 guidance."
    },
    "category": {
      "type": "string",
      "enum": [
        "architecture",
        "ci-cd",
        "debugging",
        "documentation",
        "evaluation",
        "optimization",
        "testing",
        "tooling",
        "training"
      ]
    },
    "date": {
      "type": "string",
      "pattern": "^\\d{4}-\\d{2}-\\d{2}$",
      "description": "Creation date in YYYY-MM-DD format."
    },
    "version": {
      "type": "string",
      "pattern": "^\\d+\\.\\d+\\.\\d+$",
      "description": "Semantic version."
    },
    "user-invocable": {
      "description": "Whether the skill appears in the slash-command menu.",
      "oneOf": [
        { "type": "boolean" },
        { "type": "string", "enum": ["true", "false"] }
      ]
    },
    "tags": {
      "type": "array",
      "items": { "type": "string" }
    }
  }
}
